{"schema_version":"cognitive-runtime.semantic/v2","claim_id":"sem-synthetic-preference","record_type":"preference","aliases":[],"scope":{"contexts":["writing"],"conditions":[]},"valid_time":{"from":"2026-08-11","to":null},"epistemic":"user_explicit","confidence":"high","source_refs":["src-synthetic-note"],"related_claims":[],"supersedes":[],"created_at":"2026-08-11","updated_at":"2026-08-11"}
